{
  "name": "trf",
  "version": "4.09.1",
  "description": "Tandem Repeats Finder: a program to analyze DNA sequences",
  "homepage": "https://github.com/Benson-Genomics-Lab/TRF",
  "license": "AGPL-3.0",
  "type": "make",
  "downloads": {
    "source": {
      "url": "https://github.com/Benson-Genomics-Lab/TRF/archive/refs/tags/v4.09.1.tar.gz",
      "rename": {
        "TRF-*": "trf"
      },
      "clean": [
        "trf/*~"
      ]
    }
  }
}
