{
  "name": "htmlq",
  "version": "0.4.0",
  "description": "Like jq, but for HTML",
  "homepage": "https://github.com/mgdm/htmlq",
  "license": "MIT",
  "type": "rust",
  "downloads": {
    "source": {
      "url": "https://github.com/mgdm/htmlq/archive/refs/tags/v0.4.0.tar.gz"
    }
  },
  "tests": [
    {
      "name": "version",
      "command": "htmlq",
      "pattern": "htmlq [0-9]+\\.",
      "args": "--version"
    }
  ]
}
