{
  "name": "bcftools",
  "version": "1.21",
  "description": "BCFtools - utilities for variant calling and manipulating VCFs and BCFs",
  "homepage": "https://www.htslib.org/",
  "license": "MIT",
  "type": "autotools",
  "downloads": {
    "source": {
      "url": "https://github.com/samtools/bcftools/releases/download/1.21/bcftools-1.21.tar.bz2"
    }
  },
  "tests": [
    {
      "name": "version",
      "command": "bcftools",
      "pattern": "bcftools [0-9]+\\.",
      "args": "--version"
    }
  ]
}
