{
  "name": "miniprot",
  "version": "0.13",
  "description": "Fast protein-to-genome aligner",
  "homepage": "https://github.com/lh3/miniprot",
  "license": "MIT",
  "type": "make",
  "downloads": {
    "source": {
      "url": "https://github.com/lh3/miniprot/archive/refs/tags/v0.13.tar.gz"
    }
  },
  "tests": [
    {
      "name": "version",
      "command": "miniprot",
      "pattern": "[0-9]+\\.",
      "args": "--version"
    }
  ]
}
