{
  "name": "ninja",
  "version": "1.12.1",
  "description": "A small build system with a focus on speed",
  "homepage": "https://ninja-build.org/",
  "license": "Apache-2.0",
  "type": "prebuild",
  "downloads": {
    "linux": {
      "url": "https://github.com/ninja-build/ninja/releases/download/v1.12.1/ninja-linux.zip",
      "binary": "ninja"
    },
    "macos": {
      "url": "https://github.com/ninja-build/ninja/releases/download/v1.12.1/ninja-mac.zip",
      "binary": "ninja"
    },
    "windows": {
      "url": "https://github.com/ninja-build/ninja/releases/download/v1.12.1/ninja-win.zip",
      "binary": "ninja.exe"
    }
  },
  "tests": [
    {
      "name": "version",
      "command": "ninja",
      "pattern": "^[0-9]+\\.[0-9]+\\.[0-9]+$",
      "args": "--version"
    }
  ]
}
