{
  "name": "openssl",
  "version": "3.4.1",
  "description": "OpenSSL is an open source project that provides a robust, commercial-grade, and full-featured toolkit for the Transport Layer Security (TLS) and Secure Sockets Layer (SSL) protocols",
  "homepage": "https://www.openssl.org",
  "license": "Apache-2.0",
  "type": "vcpkg",
  "tests": [
    {
      "name": "version",
      "command": "openssl",
      "pattern": "OpenSSL [0-9]+\\.",
      "args": "--version"
    }
  ]
}
