{
  "name": "sqlite3",
  "version": "3.49.0",
  "description": "SQLite is a software library that implements a self-contained, serverless, zero-configuration, transactional SQL database engine",
  "homepage": "https://sqlite.org/",
  "license": "blessing",
  "type": "vcpkg",
  "tests": [
    {
      "name": "version",
      "command": "sqlite3",
      "pattern": "[0-9]+\\.",
      "args": "--version"
    }
  ]
}
